{
  "schema": "wellmanifest.priority-state/v1alpha1",
  "revision": "sha256:example-head-20260819-v030",
  "metrics": {
    "governance.duplicate_home_count": {
      "value": 0,
      "observedAt": "2026-08-19T09:59:30Z",
      "sourceClass": "runtime_receipt",
      "revision": "sha256:example-head-20260819-v030"
    },
    "evidence.stale_or_mismatched_receipts": {
      "value": 0,
      "observedAt": "2026-08-19T09:59:30Z",
      "sourceClass": "runtime_receipt",
      "revision": "sha256:example-head-20260819-v030"
    },
    "governance.separation_of_duties_violations": {
      "value": 0,
      "observedAt": "2026-08-19T09:59:30Z",
      "sourceClass": "runtime_receipt",
      "revision": "sha256:example-head-20260819-v030"
    },
    "evidence.shape_only_pass_count": {
      "value": 0,
      "observedAt": "2026-08-19T09:59:30Z",
      "sourceClass": "test_receipt",
      "revision": "sha256:example-head-20260819-v030"
    },
    "standards.compliance_coverage": {
      "value": 1.0,
      "observedAt": "2026-08-19T09:59:30Z",
      "sourceClass": "test_receipt",
      "revision": "sha256:example-head-20260819-v030"
    },
    "standards.drift_open_count": {
      "value": 0,
      "observedAt": "2026-08-19T09:59:30Z",
      "sourceClass": "runtime_receipt",
      "revision": "sha256:example-head-20260819-v030"
    },
    "standards.governance_truth_false_block_rate": {
      "value": 0.0,
      "observedAt": "2026-08-19T09:59:30Z",
      "sourceClass": "runtime_receipt",
      "revision": "sha256:example-head-20260819-v030"
    },
    "standards.governance_truth_false_block_sample_size": {
      "value": 40,
      "observedAt": "2026-08-19T09:59:30Z",
      "sourceClass": "runtime_receipt",
      "revision": "sha256:example-head-20260819-v030"
    },
    "standards.validation_behavior_false_block_rate": {
      "value": 0.0,
      "observedAt": "2026-08-19T09:59:30Z",
      "sourceClass": "runtime_receipt",
      "revision": "sha256:example-head-20260819-v030"
    },
    "standards.validation_behavior_false_block_sample_size": {
      "value": 40,
      "observedAt": "2026-08-19T09:59:30Z",
      "sourceClass": "runtime_receipt",
      "revision": "sha256:example-head-20260819-v030"
    },
    "standards.manifest_conformance_false_block_rate": {
      "value": 0.0,
      "observedAt": "2026-08-19T09:59:30Z",
      "sourceClass": "runtime_receipt",
      "revision": "sha256:example-head-20260819-v030"
    },
    "standards.manifest_conformance_false_block_sample_size": {
      "value": 40,
      "observedAt": "2026-08-19T09:59:30Z",
      "sourceClass": "runtime_receipt",
      "revision": "sha256:example-head-20260819-v030"
    },
    "standards.conflict_density": {
      "value": 0.0,
      "observedAt": "2026-08-19T09:59:30Z",
      "sourceClass": "runtime_receipt",
      "revision": "sha256:example-head-20260819-v030"
    },
    "repair.mean_time_to_repair_minutes": {
      "value": 25,
      "observedAt": "2026-08-19T09:59:30Z",
      "sourceClass": "runtime_receipt",
      "revision": "sha256:example-head-20260819-v030"
    },
    "repair.rollback_rate": {
      "value": 0.0,
      "observedAt": "2026-08-19T09:59:30Z",
      "sourceClass": "runtime_receipt",
      "revision": "sha256:example-head-20260819-v030"
    },
    "agent.out_of_scope_action_rate": {
      "value": 0.0,
      "observedAt": "2026-08-19T09:59:30Z",
      "sourceClass": "runtime_receipt",
      "revision": "sha256:example-head-20260819-v030"
    },
    "agent.rule_citation_coverage": {
      "value": 1.0,
      "observedAt": "2026-08-19T09:59:30Z",
      "sourceClass": "runtime_receipt",
      "revision": "sha256:example-head-20260819-v030"
    },
    "planning.unverified_tool_selection_count": {
      "value": 0,
      "observedAt": "2026-08-19T09:59:30Z",
      "sourceClass": "runtime_receipt",
      "revision": "sha256:example-head-20260819-v030"
    },
    "planning.todo2code_plan_gap_count": {
      "value": 0,
      "observedAt": "2026-08-19T09:59:30Z",
      "sourceClass": "runtime_receipt",
      "revision": "sha256:example-head-20260819-v030"
    },
    "routing.required_capability_gap_count": {
      "value": 0,
      "observedAt": "2026-08-19T09:59:30Z",
      "sourceClass": "runtime_receipt",
      "revision": "sha256:example-head-20260819-v030"
    },
    "routing.context_selection_coverage": {
      "value": 1.0,
      "observedAt": "2026-08-19T09:59:30Z",
      "sourceClass": "runtime_receipt",
      "revision": "sha256:example-head-20260819-v030"
    },
    "registry.unverified_required_project_count": {
      "value": 0,
      "observedAt": "2026-08-19T09:59:30Z",
      "sourceClass": "git_ast",
      "revision": "sha256:example-head-20260819-v030"
    },
    "registry.manifest_coverage": {
      "value": 1.0,
      "observedAt": "2026-08-19T09:59:30Z",
      "sourceClass": "git_ast",
      "revision": "sha256:example-head-20260819-v030"
    },
    "offer.facade_digest_mismatch_count": {
      "value": 0,
      "observedAt": "2026-08-19T09:59:30Z",
      "sourceClass": "test_receipt",
      "revision": "sha256:example-head-20260819-v030"
    },
    "offer.duplicate_price_source_count": {
      "value": 0,
      "observedAt": "2026-08-19T09:59:30Z",
      "sourceClass": "git_ast",
      "revision": "sha256:example-head-20260819-v030"
    },
    "offer.catalog_binding_coverage": {
      "value": 1.0,
      "observedAt": "2026-08-19T09:59:30Z",
      "sourceClass": "test_receipt",
      "revision": "sha256:example-head-20260819-v030"
    }
  },
  "facts": {
    "work": {
      "delivery_needed": false
    },
    "control": {
      "priorityChangesLastHour": 3,
      "standardChangeProposalsToday": 0
    },
    "planEstimates": {
      "STD-TOOL-GROUNDED-PLANNING": {
        "files": 4,
        "changedLines": 180,
        "agentTurns": 6
      },
      "STD-ECOSYSTEM-CONTEXT-ROUTING": {
        "files": 6,
        "changedLines": 240,
        "agentTurns": 8
      },
      "STD-OFFER-SSOT-INTEGRITY": {
        "files": 4,
        "changedLines": 150,
        "agentTurns": 5
      }
    }
  }
}
